{
  "schema": 2,
  "id": "kingai.generic-uefi-amd64",
  "name": "KINGAI Generic UEFI x86-64",
  "version": "0.1.0-template",
  "arch": "amd64",
  "vendor": "KINGAI",
  "board_ids": ["generic-uefi-amd64"],
  "boot": {"method":"uefi","firmware_required":false,"dtb_required":false,"secure_boot_capable":true},
  "artifacts": [
    {"name":"kernel.bin","kind":"kernel","sha256":"0000000000000000000000000000000000000000000000000000000000000000","size_bytes":0},
    {"name":"initrd.img","kind":"initrd","sha256":"0000000000000000000000000000000000000000000000000000000000000000","size_bytes":0},
    {"name":"edge-config.json","kind":"config","sha256":"0000000000000000000000000000000000000000000000000000000000000000","size_bytes":0}
  ],
  "capabilities": [
    {"id":"device.telemetry.read","handler":"telemetry-read","operation":"read","risk":"L0","approval_required":false,"resources":["sensor:board"]},
    {"id":"device.storage.health","handler":"storage-health","operation":"read","risk":"L2","approval_required":false,"resources":["storage:root"]},
    {"id":"device.power.control","handler":"power-control","operation":"control","risk":"L4","approval_required":true,"resources":["power:system"]}
  ],
  "security": {"signed_manifest":false,"redistribution_reviewed":false,"notes":"INTEGRATION TEMPLATE ONLY. Replace hashes/artifacts, complete provenance review, sign detached manifest, then run HIL gates."}
}
